Title,Author,Year,Summary
"To Kill a Mockingbird","Harper Lee",1960,"A novel about the serious issues of rape and racial inequality."
"Pride and Prejudice","Jane Austen",1813,"A romantic novel that charts the emotional development of the protagonist Elizabeth Bennet."
"The Great Gatsby","F. Scott Fitzgerald",1925,"A novel about the American dream and the roaring twenties."
"Moby Dick","Herman Melville",1851,"A narrative of the adventures of the wandering sailor Ishmael and his voyage on the whaleship Pequod."
"War and Peace","Leo Tolstoy",1869,"A novel that chronicles the history of the French invasion of Russia."